PHASE1 ID,ID,URL,Collection,Title,Contents,Codes - Michel,Codes - Gustavo,Codes - Ivano
GitIssue907,DP79,https://github.com/turtlebot/turtlebot/issues/54,GitHubIssues,Break out linux_hardware,why dashboard is using topics for the laptop battery. It uses the diagnostics for everything else,[battery info][better representation][dashboard],[battery info] [add charge states],[architecture] [dependency] [battery as part of diagnostics]
GitIssue906,DP80,https://github.com/UBC-Thunderbots/Software/issues/223,GitHubIssues,Handle Robot Charge state,"In the old AI, the desired robot charge state (whether the capacitors are charged,",[powering with capacitor][state always float][added charge and discharge states],[battery info] [chaging state],[provide battery information] [battery state]
GitIssue897,DP81,https://github.com/ROBOTIS-GIT/turtlebot3/issues/205,GitHubIssues,"Using 1800 batteries, will the opencr board be damaged when the voltage is unstable?","is no problem. After accessing this 1800mah battery, after running for a period of time, it auto",[physical battery][opencr shuts down/cannot power on][closed without solution][hardware][FP],[voltage unstable] [testing] ??,[battery voltage]
C87222,DP82,https://github.com/jsk-ros-pkg/jsk_common/commit/a63ced4051a95399ec6d1f0cb564f760092af147,Commits,jsk_common,6d1f0cb564f760092af147': 'add hardware id tp battery capacity'},[battery info][battery capacity][add hardware id],[battery info] [hardware id?],[provide battery information] 
C82205,DP83,https://github.com/jhu-asco/aerial_autonomy/commit/22f583c2dc304122cf28ac81074d326941d72c10,Commits,aerial_autonomy,is closed\nIt also generates a land event if battery is low'},[battery warning][lower threshold][landing][uav drones],[battery info] [checks uav status],[provide battery information] [power-related events] [threshold]
C82055,DP84,https://github.com/jhu-asco/aerial_autonomy/commit/f861c94c2557008386828e251c1dabf69dcba36e,Commits,aerial_autonomy,"position control\n\nWhen taking off, if low battery, should try to land\nWhen reaching goal, if",[should land when battery is low][fixed],[bug fix] [takeoff] [land if battery is smaller than x],[battery_percent] [threshold] [test] [abort_mission] [safety]
C73332,DP85,https://github.com/ipa320/cob_robots/commit/40fd5e300e75d5f82fb4f06293c024f360a0910b,Commits,cob_robots,"06293c024f360a0910b': 'added ur10, phidgets, battery monitor, em monitor to robot bringup for raw",[battery info][monitor launch file],[battery info] [battery monitor],[provide battery information] 
C73261,DP86,https://github.com/ipa320/cob_robots/commit/f2e7aecd52b50210a55210fb38eb9f026b0eb514,Commits,cob_robots,7aecd52b50210a55210fb38eb9f026b0eb514': 'use powerstate from phidget node'},[phidget devices plugin][reuse powerstate function],[power functions] [power state],[provide battery information] 
C73016,DP87,https://github.com/ipa320/cob_robots/commit/24d9ddb0d4595ccd7d3520115f1b20ab24a2828d,Commits,cob_robots,5ccd7d3520115f1b20ab24a2828d': 'configurable battery thresholds'},"[battery warning/][setting up warning, error and critical thresholds]",[battery info] [battery thresholds],[configurable battery thresholds]
C70904,DP88,https://github.com/ipa320/cob_robots/commit/a5c9a887d7a45a63f53aa4f05f43911c8729e3a1,Commits,cob_robots,d7a45a63f53aa4f05f43911c8729e3a1': 'enhanced battery monitoring'},[battery info/monitoring],[battery info],[provide battery information] [power-related events] [threshold] [technical debt]
C70875,DP89,https://github.com/ipa320/cob_robots/commit/65f96aacf9a0e8396ad1ad88e4ba2202d94be33e,Commits,cob_robots,96aacf9a0e8396ad1ad88e4ba2202d94be33e': 'add battery and emergency monitor for cob3-6'},[battery monitor][stop due to monitor][launch files],[battery info],[provide battery information] [battery warning]
C70854,DP90,https://github.com/ipa320/cob_robots/commit/a821a4ee9fa077df8cd8eaa986c4c8ab1aee96fa,Commits,cob_robots,c8ab1aee96fa': 'add config for emergency and battery monitor'},[warning thresholds][configuration files],[config] [battery info] [battery monitor],[technical debt] [configurable battery thresholds] [battery warning]
C66043,DP91,https://github.com/ipa320/cob_environment_perception/commit/e2936eec9c64a3d67ba25c60ae53b56d19b0f002,Commits,cob_environment_perception,64a3d67ba25c60ae53b56d19b0f002': 'introduced energy factor'},[cannot code],??,[FP]
ROSD144,DP92,https://discourse.ros.org/t/autoware-reference-platform-working-group-meeting-3/11451,ROSDiscourse,Autoware Reference Platform Working Group Meeting #3,"heng
Requests by Kalray and TierIV
Estimated power consumption : 20-30 Watts (without accelerat",[power consumption info][autoware reference][autocore board],,
ROSD138,DP93,https://discourse.ros.org/t/project-azure-for-kinect-4th-gen-kinect/4729,ROSDiscourse,Project Azure for Kinect (4th gen Kinect),ncy and modulation contrast resulting in low power consumption with overall system power of 225,[power consumption][highest modulation frequency][low consumption][kinect],,
ROSD12,DP94,https://discourse.ros.org/t/using-nuc-with-kobuki/489,ROSDiscourse,Using NUC with Kobuki,was aware of a power solution e.g. external battery that can connect to the Kobuki 19v output AN,[kobuki robot][auto dock][compact computers],,
ROSD101,DP95,https://discourse.ros.org/t/dont-miss-eu-funding-for-ros-developments-via-rosin-ftps-next-cut-off-dates-june-14-sept-13-2019/8999,ROSDiscourse,"Don't miss EU funding for ROS developments via ROSIN FTPs - Next cut-off dates: June 14 & Sept 13, 2019","ent solutions (in terms of computation time, energy consumption) for a specified task. Currently",[topics for future conference][energy consumption][benchmarking][FP],,
ROSA77,DP96,https://answers.ros.org/question/223046/control-8x8-grid-of-rgb-leds-like-raspberry-pi-sense-hat-or-unicorn-hat/,ROSAnswers,Control 8x8 grid of RGB LEDs like Raspberry Pi Sense Hat or Unicorn Hat?,ompletely new to ROS.We have a project where battery power is limited but we need some real-time,[energy efficiency][visualization but rviz][RGB led grid][real-time visualization as energy inefficiency],,
ROSA755,DP97,https://answers.ros.org/question/323055/equip-arduino-based-lawn-mower-with-ros/,ROSAnswers,Equip Arduino based lawn mower with ROS,"(like a fence)
- IMU
- Odometry
- monitoring power consumption of motors (to detect high lawn a",[battery info][monitoring motor power][mowing lawn],,
ROSA74,DP98,https://answers.ros.org/question/218412/shutdown-nodes-from-within-a-ros-node/,ROSAnswers,Shutdown nodes from within a ROS node,"like to achieve is something like this:
Once battery level is below a certain threshold:However I",[shutdown ros nodes][low battery][how to kill nodes],,
ROSA737,DP99,https://answers.ros.org/question/263682/our-robot-will-be-equipped-with-lidars-sterio-camera-slam-algorithm-machine-vision-and-similar-loads-please-suggest-us-the-computer-specification/,ROSAnswers,"Our robot will be equipped with lidars, sterio camera, SLAM algorithm, machine vision and similar loads. Please suggest us the computer specification which will be ideal and optimal?","ng? Do you have any constrains about weight, power consumption?Weight constrain is not there as",[hardware requirement][no battery constraint][FP],,
ROSA725,DP100,https://answers.ros.org/question/236888/how-to-get-the-battery-status-of-a-robot-in-gazebo/,ROSAnswers,How to get the battery status of a robot in gazebo?,ebo world moving around. I need to get their battery status like how much battery are they consum,[battery info][husky robots gazebo][no answer],,
ROSA72,DP101,https://answers.ros.org/question/215130/problem-connect-turtlebot-and-workstation/,ROSAnswers,Problem connect turtlebot and workstation,577.419304] Battery : unable to check laptop battery info [global name 'exceptions' is not define,[FP],,
ROSA716,DP102,https://answers.ros.org/question/214026/getting-started-with-ros/,ROSAnswers,Getting Started with ROS,unds like very high performance and very low power consumption. Would the TK1 be used only for,[TPK1 package][high performance][low power consumption],,
ROSA71,DP103,https://answers.ros.org/question/214554/shutdown-system-computer-with-a-ros-node/,ROSAnswers,Shutdown system (computer) with a ROS node,"I would like to shutdown the system once the battery level reaches a certain point, however I don",[shutdown system][battery low threshold][how to kill all],,
ROSA708,DP104,https://answers.ros.org/question/199865/commanding-simple-paths-curves-to-move_base/,ROSAnswers,Commanding simple paths / curves to move_base,HiI want to measure the power consumption of my robot when it moves on som,[measure energy consumption][following specific path][no answer],,
ROSA633,DP105,https://answers.ros.org/question/324688/2d-navigation-with-arduino-irobot/,ROSAnswers,2d navigation with Arduino + iRobot?,"ncludes IMU data, wheel odom, bumper states, battery voltage, and laser scan data. It's absolutel",[FP],,
ROSA61,DP106,https://answers.ros.org/question/42059/unable-to-check-laptop-battery/,ROSAnswers,Unable to check laptop battery [closed],"the issue: Turtlebot unable to check laptop battery state, as explained in greater detail in I",[unable to check battery state][turtlebot][no answer],,
ROSA606,DP107,https://answers.ros.org/question/245514/dc-motor-encoder-python/,ROSAnswers,DC MOTOR + ENCODER + PYTHON,"voltage regulator that can take a variety of battery voltages, and will power the Pi, too. It has",[FP],,
ROSA60,DP108,https://answers.ros.org/question/112261/brand-new-roomba-790-malfunctioning/,ROSAnswers,Brand new Roomba 790 Malfunctioning,at the same time for 30 seconds. Charge the battery for a good 16 hours after the reset.,[recharge battery after reseting][don't say why],,
ROSA6,DP109,https://answers.ros.org/question/9868/how-to-mount-a-kinect-with-my-laptop-without-any-ac-adapter/,ROSAnswers,How to mount a Kinect with my laptop without any AC Adapter [closed],"ct without any AC Adapter. Turtlebot use use energy from roomba, but I would like to use other p",[kinect with laptop][regulate tension to 8v][hardware][FP],,
ROSA59,DP110,https://answers.ros.org/question/99576/questions-about-irobot-create/,ROSAnswers,questions about irobot create,"A batteries? I'm inclined on not getting the battery pack, since I'd be using the robot in europe",[AA battery autonomy][not answered],,
ROSA58,DP111,https://answers.ros.org/question/92891/using-smach-to-monitor-robot-battery-level/,ROSAnswers,Using SMACH to monitor robot battery level,scenario using SMACH.The robot monitors its battery level on a topic called /battery_level using,[battery monitoring][navigation state machine][overall sm energy and nav],,
ROSA562,DP112,https://answers.ros.org/question/55151/turtlebot-netbook-battery-error/,ROSAnswers,Turtlebot Netbook Battery Error,"pply_class.txt
My system provided power_now, energy_now and voltage_now that I could use to calc",[battery error][minimal launch][unsupported hardware][coding],,
ROSA544,DP113,https://answers.ros.org/question/51273/is-there-a-ros-package-that-can-provide-gui-for-other-ros-nodes/,ROSAnswers,Is there a ros package that can provide GUI for other ros nodes?,"to show the information gathered by camera, battery power and temperature sensor.It would be bet",[battery info][GUI],,
ROSA54,DP114,https://answers.ros.org/question/67616/turtlebot-unable-to-check-laptop-batterybat0state/,ROSAnswers,Turtlebot unable to check laptop battery/BAT0/state,"is Fuerte. Turtlebot unable to check laptop battery/BAT0/state.
I think there is laptop battery",[battery info/state][unable to check][path in lauch file],,
ROSA537,DP115,https://answers.ros.org/question/30670/turtleboteu-power-board-and-kinect/,ROSAnswers,turtlebot.eu power board and kinect,ot.eu power board. I don't have any external battery so everything is power through roomba's batt,[lack of power kinect][image freezes][solution: external battery],,
ROSA512,DP116,https://answers.ros.org/question/9588/has-anyone-worked-with-the-clearpath-robotics-husky-a200/,ROSAnswers,Has anyone worked with the Clearpath Robotics Husky A200?,"odometric readings, system and power status, battery levels, etc), all published cleanly on separ",[FP],,
ROSA51,DP117,https://answers.ros.org/question/59996/cancelling-a-ros-action-within-an-executive_teer-node/,ROSAnswers,Cancelling a ROS action within an executive_teer node,points in a map using MoveBase actions and a battery_check task that monitors a simulated battery,[battery low][auto dock][robot do not return to base][code correction],,
ROSA458,DP118,https://answers.ros.org/question/249777/hector-exploration-slow/,ROSAnswers,Hector Exploration Slow?,"pretty slow when the computer is only on the battery, when it's plugged in the normal power outle",[hector exploration too slow][battery mode][CPU slows down][ROS master],,
ROSA411,DP119,https://answers.ros.org/question/218043/what-compact-pc-to-buy-to-run-ros-in-a-mobile-robot/,ROSAnswers,What compact PC to buy to run ROS in a mobile robot,ts easy to power from the robot's batteries (battery board) if the computer only requires unregul,[hardware][power line or battery][FP],,
ROSA405,DP120,https://answers.ros.org/question/272286/ros-compatible-sbc-or-minipc-for-turtlebot-kobuki/,ROSAnswers,ros compatible SBC or minipc for Turtlebot (Kobuki),"ased cpus.
Since the TK1 runs off the Kobuki battery, power usage is a big thing.
Are the other c",[arm based cpu][energy consumption of CPU],,
ROSA4,DP121,https://answers.ros.org/question/60765/data-droping-at-transport-layer/,ROSAnswers,Data Droping at transport layer,"ts at Transport layer. To save the bandwidth,energy of nodes and reduce the congestion. So is it",[dropping useless tcp pkts][energy saving][filtering tools/iptables][possible FP],,
ROSA39,DP122,https://answers.ros.org/question/27666/turtlebot-gmapping-large-area/,ROSAnswers,turtlebot gmapping large area,e I got a power error on the dashboard. The battery display showed that there was plenty of powe,[turtlebot mapping error][stops after 45 minutes][display shows plenty of power],,
ROSA386,DP123,https://answers.ros.org/question/253918/best-rgbd-camera-for-ros-on-a-raspberry-pi/,ROSAnswers,Best RGBD camera for ROS on a Raspberry Pi,"ezy, so limited to USB 2.0 I think. I have a battery pack (10w, 5200mAh) which needs to power the",[FP],,
ROSA384,DP124,https://answers.ros.org/question/251211/i-am-trying-to-start-turtlebot-but-it-is-not-starting/,ROSAnswers,"i am trying to start turtlebot , but it is not starting.","ng bot or green led on status. i checked the battery cable it is connected to 12v 1.5A perfectly,",[kobuki do not run][incompatible battery][low voltage][could be FP],,
ROSA36,DP125,https://answers.ros.org/question/11956/turtlebot-doesnt-start-rotating-on-calibration/,ROSAnswers,Turtlebot doesn't start rotating on calibration,"ibration file, even though still shows the battery amount and breakers in green.Env) Ubuntu 10.",[FP][battery is in green],,
ROSA359,DP126,https://answers.ros.org/question/210592/keyerrorlaptop_battery_state/,ROSAnswers,KeyError:'laptop_battery_state',"th the kobuki_dashboard.I can see the kobuki battery but not the laptop one. and when i do a ""ros",[battery info][laptop battery state not shows up],,
ROSA357,DP127,https://answers.ros.org/question/207710/kinect-stops-when-moving-motor/,ROSAnswers,Kinect stops when moving motor,e Laptop connected to the same power source (battery). Whats the whole setup? The motors get the,[kinet error][battery configuration][FP],,
ROSA342,DP128,https://answers.ros.org/question/185261/pocketsphinx-microphone-connection-is-unreliable/,ROSAnswers,pocketsphinx microphone connection is unreliable,"that some process went to sleep mode, like a power save feature.Well, what I could see is that",[mic stops working][sleep mode][save energy],,
ROSA341,DP129,https://answers.ros.org/question/174855/create-powers-off-after-minimallaunch/,ROSAnswers,Create powers off after minimal.launch,"low), but I dont see a prompt. I checked the battery and that's charged so that's not the problem",[energy consumption][waiting for messages],,
ROSA3,DP130,https://answers.ros.org/question/61318/udpros-protocol-and-lost-packetsequencing-algorithms/,ROSAnswers,UDPROS Protocol and Lost Packet/Sequencing Algorithms,"Option 2 requires more processing power and energy usage to maintain timeouts, and Option 2 han",,,
ROSA291,DP131,https://answers.ros.org/question/12127/cant-get-data-from-create-robot-error-reading-from-sci-port-ttyusb0/,ROSAnswers,Cant get data from Create robot - Error reading from SCI port ttyUSB0,"the sensors are Stale apart from the Laptop battery one, and when I do I get the code below. We",[FP],,
ROSA290,DP132,https://answers.ros.org/question/11994/turtlebot-arm-servos-not-being-recognized/,ROSAnswers,Turtlebot arm servos not being recognized [closed],rbotix board directly off of a iRobot Create battery (as opposed to going through the power board,[FP],,
ROSA262,DP133,https://answers.ros.org/question/200897/robot-hits-the-obstacles-and-turns-around-occasionally-using-navigation-stack/,ROSAnswers,robot hits the obstacles and turns around occasionally using navigation stack,"t. Then i equipped my robot with a 25 v LiPo battery and now when navigating, it hits the obstacl",[high battery level][too fast][hits obstacles],,
ROSA25,DP134,https://answers.ros.org/question/191251/battery_state_of_charge-publishes-nothing-on-pioneer3dx/,ROSAnswers,battery_state_of_charge publishes nothing on Pioneer3DX,"ion is written that, if the pioneer supports battery_state_of_charge the topic is published. The",[battery info issue][Pioneer3DX][no answer],,
ROSA230,DP135,https://answers.ros.org/question/239958/ros-isnt-recognizing-create/,ROSAnswers,ROS isn't recognizing Create,need to install? I've heard it could be the battery but I haven't received any error messages re,[error contacting device][could be battery],,
ROSA22,DP136,https://answers.ros.org/question/295138/the-error-about-roslaunchwhen-driving-the-teleoperating-part/,ROSAnswers,"the error about ""roslaunch""when driving the teleoperating part","ng the turtlebot software doesn't expose any battery information through ACPI, so the cannot rea",[error while launching][no battery info][acpi],,
ROSA219,DP137,https://answers.ros.org/question/192938/are-there-standard-battery-level-messages-in-ros/,ROSAnswers,are there standard battery level messages in ROS,"ot, are there existing standard messages for battery level (in %) or voltage, or thresholds (low)",[battery info][std messages],,
ROSA217,DP138,https://answers.ros.org/question/30631/turtlebot-unable-to-check-laptop-batterybat0state/,ROSAnswers,Turtlebot unable to check laptop battery/BAT0/state,My laptop (Thinkpad X120e) reports its battery status in proc/acpi/battery/BAT1/ folder (wh,[battery info issue][wrong file path],,
ROSA21,DP139,https://answers.ros.org/question/285774/running-turtlebot-minimallaunch-on-a-pc-no-battery-state/,ROSAnswers,"Running Turtlebot minimal.launch on a PC, no battery state.",_full_design || /sys/class/power_supply/BAT0/energy_full_design does not exist],[battery warning][laptop][not receiving],,
ROSA207,DP140,https://answers.ros.org/question/313363/local-planner-behaves-unordinary/,ROSAnswers,Local planner behaves unordinary,our robot is moving on and the state of your battery. I was experimenting with my large outdoor,[robot navigation][depends on battery level],,
ROSA206,DP141,https://answers.ros.org/question/336929/ros-newby-suitability-of-old-thinkpad-x240/,ROSAnswers,ROS newby - suitability of old Thinkpad X240?,"hinkpad. The only drawback in my case is the battery life, which for mine lasts only 2 hours or s",[battery of thinkpad laptop][FP],,
ROSA204,DP142,https://answers.ros.org/question/334408/using-rosserial-to-read-data-from-a-device/,ROSAnswers,Using rosserial to read data from a device,r code.If you're writing the firmware of the battery management system yourself then you could us,[battery info][battery management system][serial node publishing],,
ROSA20,DP143,https://answers.ros.org/question/152146/integration-of-energy-framework-with-ros/,ROSAnswers,Integration of energy framework with ROS,rking on a software framework to monitor the energy consumption of robots or any embedded device,[monitor energy consumption][api][need to integrate to ROS],,
ROSA2,DP144,https://answers.ros.org/question/54840/alternate-turtlebot-configurations/,ROSAnswers,Alternate Turtlebot Configurations,"equiring 12V) with the much smaller and more energy efficient , which only needs 5V over USB? I",[auto recharging][turtlebot2 as a solution],,
ROSA198,DP145,https://answers.ros.org/question/300209/robot-bucking-while-driving-in-reverse/,ROSAnswers,"Robot ""bucking"" while driving in reverse",em because it seems to change if I slide the battery around a little. It doesn't solve it but it,[FP],,
ROSA194,DP146,https://answers.ros.org/question/270751/turtlebot-charging-without-battery/,ROSAnswers,turtlebot charging without battery,rtlebot was delivered without the additional battery: 4S2P (4400 mAh) that has to be connected in,[FP],,
ROSA193,DP147,https://answers.ros.org/question/269683/intel-euclid-battery-state/,ROSAnswers,Intel Euclid battery state,orm and I'm trying to find a solution to get battery state.Any ideas or suggestionsThanks in adva,[battery info][Intel Euclid][ros topic],,
ROSA19,DP148,https://answers.ros.org/question/151946/ros-internals-topics-storage-and-network-comms/,ROSAnswers,ROS internals - topics storage and network comms?,rking on a software framework to monitor the energy consumption of robots or any embedded device,[energy consumption monitoring][framework][integrate to ROS][ros topic][same as ROSA20],,
ROSA189,DP149,https://answers.ros.org/question/251877/slam-with-a-camera-without-odometry/,ROSAnswers,SLAM with a camera without odometry,r converter to produce this voltage from the battery that your RC car has. Then you'll have a ful,[FP],,
ROSA186,DP150,https://answers.ros.org/question/243928/din-usb-cable/,ROSAnswers,DIN-USB cable,rested in powering devices from the Roomba's battery you can see my about making your own.,[FP],,
ROSA184,DP151,https://answers.ros.org/question/236426/p2os-and-rosaria-not-connecting-to-pioneer-p3-at/,ROSAnswers,P2os and rosaria not connecting to Pioneer P3-AT,switch on the side. This will give you extra battery life and prevent any possible interference w,[FP],,
ROSA183,DP152,https://answers.ros.org/question/231771/rospy-sensor_msgsmsgbatterystate-is-not-found/,ROSAnswers,rospy sensor_msgs.msg.BatteryState is not found,"public apt repository.If you really need the battery message, you can use sensor_msgs from source",[battery info issue][sensor_msg][implementation feature],,
ROSA182,DP153,https://answers.ros.org/question/210527/how-to-integrate-kobuki-auto-docking-command-in-roscpp-or-python/,ROSAnswers,how to integrate kobuki auto docking command in roscpp or python,ogram automatically when it detects that the battery is low? then how to add that program to my c,[turtlebot and kobuki base][auto docking][implementation in python or C++],,
ROSA181,DP154,https://answers.ros.org/question/219948/7-8-tablet-for-turtlebot/,ROSAnswers,"7-8"" Tablet for Turtlebot?",y 2-in-1 Inspiron 11 3157 (that has terrific battery life and is Ubuntu-certified).If you are wil,[FP],,
ROSA179,DP155,https://answers.ros.org/question/192672/what-should-i-expect-from-turtlebot-calibration-how-do-i-know-if-my-turtlebot-is-broken/,ROSAnswers,What should I expect from Turtlebot calibration? / How do I know if my Turtlebot is broken?,"to hardware (IMU and Battery). If the Ni-Mh battery is old and used over many charging cycles, i",[turtlebot hardware config][old battery][needs power reset],,
ROSA178,DP156,https://answers.ros.org/question/218715/battery-usage-simulation-in-gazebo/,ROSAnswers,Battery Usage Simulation in Gazebo,"hat is best practice in simulating a robot's battery usage in gazebo?I have a robot, and therefor",[battery simulation][gazebo plugin],,
ROSA176,DP157,https://answers.ros.org/question/207130/contacting-turtlebot-distributor-i-heart-engineering/,ROSAnswers,Contacting Turtlebot Distributor (I Heart Engineering).,r a while and there is only 2 that have this battery issue. I did some research on the model of a,[FP],,
ROSA175,DP158,https://answers.ros.org/question/204239/long-term-turtlebot-storage-and-care/,ROSAnswers,Long term turtlebot storage and care,Open the bottom of the Kobuki and unplug the battery pack. And remove the battery from the laptop,[battery maintanance][life unplugged],,
ROSA174,DP159,https://answers.ros.org/question/201704/how-to-power-off-kinect-from-software/,ROSAnswers,How to power off Kinect from software,"s, compute (or measure) their affect on your battery life, and figure out which steps actually ca",[save energy][howto][turnoff kinect],,
ROSA171,DP160,https://answers.ros.org/question/170766/tum_ardrone-autopilot/,ROSAnswers,tum_ardrone autopilot,and the drone took off after inserting a new battery and things like that. You could post some lo,[FP],,
ROSA168,DP161,https://answers.ros.org/question/127171/ekf-dosent-work-perfectly/,ROSAnswers,EKF dosen't work perfectly,stimating model parameters from output data (battery time until full while charging).,[FP],,
ROSA164,DP162,https://answers.ros.org/question/64292/rostopic-echo-to-webpage/,ROSAnswers,rostopic echo to webpage,e output from rostopic echo (for example the battery level) to a webpage? You can look at for t,[FP],,
ROSA163,DP163,https://answers.ros.org/question/58588/turtlebot-bringup-problems/,ROSAnswers,Turtlebot bringup problems,very helpful. This usually happens when the battery is very low or going bad. I would get a mult,[turtlebot turns off automatically][battery very low],,
