PHASE1 ID,ID,URL,Collection,Title,Contents,Codes - Michel,Codes - Gustavo,Codes - Ivano
ROSA162,DP164,https://answers.ros.org/question/57161/turtlebot_bringup-error-invalid-param-tag/,ROSAnswers,turtlebot_bringup error - invalid <param> tag [closed],e roslaunch works fine except for the laptop battery warning which I have described here - Thank,[FP],,
ROSA161,DP165,https://answers.ros.org/question/12900/microsoft-kinect-or-asus-xtion/,ROSAnswers,Microsoft Kinect or ASUS Xtion ? [closed],"is handy, but (if you can get access to raw battery voltage on your Roomba, like you can on a cr",[energy consumption of kinect],,
ROSA158,DP166,https://answers.ros.org/question/41829/turtlebot-clearpath-kinect-visualization-tutorial/,ROSAnswers,Turtlebot (clearpath) Kinect Visualization Tutorial,"unable to fetch information in the laptop's battery charge state.
I can set the robot to full mo",[battery info issue][unable to get battery state][wrong file path],,
ROSA156,DP167,https://answers.ros.org/question/51181/how-to-connect-the-kinetic-sensor-to-my-ros-computer/,ROSAnswers,How to connect the kinetic sensor to my ROS computer,transformer it self and hook it to my robot battery...I recall there's a way of connecting a kin,[FP],,
ROSA155,DP168,https://answers.ros.org/question/45885/rviz-unsaved-changes/,ROSAnswers,rviz: unsaved changes,"rviz from time to time when I am working on battery, it saves some power (opengl likes my cpu).A",[energy consumption][rviz closed][save energy],,
ROSA153,DP169,https://answers.ros.org/question/36330/p2os-teleop/,ROSAnswers,P2OS teleop,"rostopic list
/aio
/base_controller/command
/battery_state
/cmd_motor_state
/cmd_vel
/diagnostics",[FP],,
ROSA1520,DP170,https://answers.ros.org/question/263114/i-want-to-control-10-dynamixel-motors-using-ros-python-i-am-succeeding-up-to-6-motors-at-a-time-but-not-all/,ROSAnswers,I want to control 10 dynamixel motors using ROS Python. I am succeeding up to 6 motors at a time but not all,"ration what i want to do. This looks like a voltage drop issue. In our arm we have 7 motors,",[motor control issue][possibe voltage drop][denied by dev][FP],,
ROSA151,DP171,https://answers.ros.org/question/38199/error-reading-from-sci-port-no-data-turtlebot-disconnects-when-set-full-mode/,ROSAnswers,Error reading from SCI port. No data. Turtlebot disconnects when set Full Mode,meter) please measure the voltage across the battery to make sure that it is fully charged. Simil,[error reading SCI port][check battery voltage][full charge],,
ROSA1509,DP172,https://answers.ros.org/question/223633/how-to-make-a-slam-robot-with-navigation/,ROSAnswers,How to make a slam robot with navigation?,"o parts are still missing:
Battery plus some voltage converters. You can use a USB-Powerbank f",[FP],,
ROSA1508,DP173,https://answers.ros.org/question/220233/battery-monitor/,ROSAnswers,Battery Monitor,not using a laptop computer. I have lithium battery running everything. I would like to add a b,[battery monitor hardware][arduino nano],,
ROSA1490,DP174,https://answers.ros.org/question/53457/kinect-dies-when-using-the-follower-example-on-a-turtlebot/,ROSAnswers,kinect dies when using the follower example on a turtlebot,be a current issue. I would think that the battery pack could source plenty of current unless m,[kinect dies][battery current],,
ROSA149,DP175,https://answers.ros.org/question/36430/gazebo-dead-slow-on-8x27ghz-cpu-with-a-nvidia-gt650m-gpu/,ROSAnswers,Gazebo dead slow on 8x2.7GHz cpu with a NVidia GT650m gpu,"has Optimus, with a sticker promising great battery life and great performance. I don't care for",[FP],,
ROSA147,DP176,https://answers.ros.org/question/32736/react-on-diagnostics-eg-shutdown-on-low-battery/,ROSAnswers,react on diagnostics (eg shutdown on low battery),"and?I'd like to shutdown the robot PC if the battery goes low (which the OS isn't aware of), and",[battery diagnostic][shutdown when battery is low][simple msgs easy to parse],,
ROSA1451,DP177,https://answers.ros.org/question/306234/looking-for-existing-electromyograph-emgeeg-or-voltage-messages/,ROSAnswers,"Looking for existing Electromyograph EMG/EEG, or voltage messages","EEG/EMG.There was a lightning talk about a (consumer) EEG device last ROSCon (), but that doesn",[FP],,
ROSA144,DP178,https://answers.ros.org/question/12973/kinect-issues-on-different-machines/,ROSAnswers,kinect issues on different machines,", the Kinect gets it power from the create's battery, not the USB. (The suspicious unconnected c",[false power up - kinect seems on but it does not work since it does not receive enough power],,
ROSA1437,DP179,https://answers.ros.org/question/217804/problem-creating-a-ros-package-with-the-presence-of-external-headers/,ROSAnswers,Problem creating a ROS package with the presence of external headers,"ions, for example to read the voltage of the battery, and publish the data as ROS messages. 
I pu",[battery info][ROS msg][failure],,
ROSA1427,DP180,https://answers.ros.org/question/51036/irobot-create/,ROSAnswers,irobot create,a step-down appliance into my irobot adapter/charger ! :-) I just checked the transformer. It,[FP],,
ROSA1425,DP181,https://answers.ros.org/question/38786/problem-adding-rosserial-node-to-turtlebot-bringup/,ROSAnswers,Problem adding rosserial node to turtlebot bringup,"al.launch to have the following. The ""laptop battery"" stuff has been pulled out since I am using",[battery diagnostic][launch file],,
ROSA142,DP182,https://answers.ros.org/question/12385/irobot-create-odometry-package/,ROSAnswers,irobot create odometry package,"kely that ...i recognized somehing. When the battery is not full, it gives erroneous measurements",[wrong odometry data][when battery not full],,
ROSA1418,DP183,https://answers.ros.org/question/218015/problem-in-determining-a-link-language-while-using-external-libraries/,ROSAnswers,Problem in determining a link language while using external libraries,"ions, for example to read the voltage of the battery, and publish the data as ROS messages. I put",[battery info][ROS msg][howto help],,
ROSA1412,DP184,https://answers.ros.org/question/293771/publisher-can-only-in-while-no-maybe-other-reason/,ROSAnswers,"publisher can only in While? no, maybe other reason.",PC.Last night I recharge the raspberry's li battery and this morning the code works fine.The pro,[subscriber cannot read][battery level],,
ROSA141,DP185,https://answers.ros.org/question/12263/kinect-does-not-turn-on-turns-off-on-its-own/,ROSAnswers,Kinect does not turn on / turns off on its own,"he kinect goes off again. I thought it was a battery problem, but the dashboard shows the battery",[kinect issue][wrong battery info],,
ROSA1406,DP186,https://answers.ros.org/question/30433/turtlebot-and-turtlebot-arm-and-hokuyo-laser-rangefinder/,ROSAnswers,Turtlebot and turtlebot arm and hokuyo laser rangefinder,"t shutting down the Kinect, Laser or Arm the battery empty faster than it can refill and may dama",[FP],,
ROSA1403,DP187,https://answers.ros.org/question/151526/using-move_base-recovery-for-initial-pose-estimation/,ROSAnswers,using move_base recovery for initial pose estimation,utocking sequence. Turtlebot have a docking (battery recharger) with infra-red emitters and the r,[auto docking][initial position estimation][turtlebot and base with infra-red],,
ROSA1402,DP188,https://answers.ros.org/question/287099/turtlebot-bringup-not-connecting-to-port/,ROSAnswers,TurtleBot Bringup Not Connecting to Port,"?
Thanks.Turns out it was a power issue. The battery was too low to power the OpenCR board, so ma",[turtlebot][connection issue][insufficient battery to power OpenCR],,
ROSA1396,DP189,https://answers.ros.org/question/267407/about-battery-management-systems/,ROSAnswers,About Battery Management Systems,"WalterWhy do you need a BMS on a 4S, 6S LiPo battery? These battery packs can operate without th",[smart BMS][recharge on the robot][4 cells pcm][hardware][FP?],,
ROSA1394,DP190,https://answers.ros.org/question/254899/ros-battery-status/,ROSAnswers,ROS Battery Status,"d car) batteries as well as some Lithium Ion battery packs. Unfortunately, none of the team membe",[battery monitoring][car battery][battery voltage],,
ROSA1393,DP191,https://answers.ros.org/question/248531/connect-failed-rosaria-with-robot/,ROSAnswers,Connect failed RosAria with Robot,f neccesary. Make sure the robot is fully charged or plugged in to the charger (with good ba,[FP],,
ROSA139,DP192,https://answers.ros.org/question/11276/best-pc-architecture-to-run-turtlebot/,ROSAnswers,Best PC architecture to run Turtlebot,ter to run on the TurtleBot is a tradeoff of battery life for computation and price. In general,[tradeoff][computation power][turtlebot],,
ROSA1389,DP193,https://answers.ros.org/question/221362/turtlebot-bad-gyro-calibration/,ROSAnswers,turtlebot bad gyro calibration,"rcuit board from your CREATE Base. On a full battery charge, ensure that there is a constant 5V p",[error gyro calibration][possible power supply issue],,
ROSA1386,DP194,https://answers.ros.org/question/202176/kinect-isnt-visible-from-odroid-when-battery-powered-turtlebot-v2/,ROSAnswers,Kinect isn't visible from Odroid when battery powered (turtlebot v2),Kinect that doesn’t work when the odroid is battery driven. Everything except the things in the,[odroid pcb][kinect not visible][when battery driven][solved by external battery],,
ROSA1382,DP195,https://answers.ros.org/question/198802/can-rosaria-and-p2os-both-be-used-simultaneously-for-pioneer-robots/,ROSAnswers,Can RosAria and p2os both be used simultaneously for pioneer robots?,e finder. I am however unable to monitor the battery and robot status. Are there any tools to mon,[rosaria][battery monitoring issue][battery voltage topic],,
ROSA1372,DP196,https://answers.ros.org/question/65437/workstation-as-master-turtlebot/,ROSAnswers,Workstation as Master [Turtlebot],e Create. This usually means your turtlebot battery needs to be charged. Or that the connection,[turtlebot][odometry error][not battery],,
ROSA1371,DP197,https://answers.ros.org/question/58247/turtlebot2-power-for-laptop/,ROSAnswers,Turtlebot2 power for laptop,"Hello,I would like to use the battery of the Kobuki base of my turtlebot to give p",[hardware][FP],,
ROSA137,DP198,https://answers.ros.org/question/10397/is-visualization-ok-on-laptops-with-optimusbumblebee/,ROSAnswers,Is visualization OK on laptops with Optimus+Bumblebee?,"orked fine (unfortunately, you don't get the battery savings that optmius integrated graphics wou",[optimus nvidia][battery saving][do not work on ubuntu],,
ROSA1368,DP199,https://answers.ros.org/question/38848/dashboard-is-unble-to-check-the-laptop-battey-state/,ROSAnswers,Dashboard is unble to check the laptop battey state,e: 1342422151.301084] Unable to check laptop battery state. Exception: Value 12265 mW did not hav,[battery info][unable to check laptop][wrong file path],,
ROSA1366,DP200,https://answers.ros.org/question/34239/turtlebot-dying-when-launching-kinect/,ROSAnswers,Turtlebot dying when launching kinect,down issue is that I swapped to a new laptop_battery.py and it seems to not show the correct char,[turtlebot runs out of battery][kinect connected][battery misinfo],,
ROSA1362,DP201,https://answers.ros.org/question/11885/file-rospack-find-turtlebot_navigationnav_rvizvcg-does-not-exist/,ROSAnswers,file [rospack find turtlebot_navigation/nav_rviz.vcg] does not exist,dashboard to light up properly as one of the battery lights never turn green but both batteries a,[troubles bringing up map][rviz][battery led is misconfigured too],,
ROSA136,DP202,https://answers.ros.org/question/9647/how-to-connect-kinect-to-a-12v-battery/,ROSAnswers,How to connect Kinect to a 12v battery,mount my kinect on my robot which has a 12v battery. i am a completely noob in the field of elec,[hardware][FP],,
ROSA1359,DP203,https://answers.ros.org/question/10903/does-battery-matter-to-simulated-pr2-robot/,ROSAnswers,Does 'Battery' matter to simulated pr2 robot,"nning pr2 in simulation for a long time, the battery will go down eventually to 0. Does that matt",[battery level][simulating pr2 robot][does not matter],,
ROSA1357,DP204,https://answers.ros.org/question/9448/loading-a-prior-map-with-gmapping/,ROSAnswers,Loading a prior map with gmapping,". Imagine a robot that maps, then docks to recharge. The dock is at the same location as the st",[FP],,
ROSA1354,DP205,https://answers.ros.org/question/29648/failed-to-put-the-turtlebot-in-full-mode/,ROSAnswers,Failed to put the turtlebot in full mode,"do this:Then, restart. If that doesn't work, charge your turtlebot. This happens every once and",[failure][turtlebot to full mode][battery recharge],,
ROSA1344,DP206,https://answers.ros.org/question/337861/autonomous-docking/,ROSAnswers,Autonomous docking,"I have a DIY robot that docks itself on the charger.
I use AMCL and Navigation stack to put th",[auto docking][howto][infra-red or camera],,
ROSA134,DP207,https://answers.ros.org/question/10546/pni-digital-compass-driver/,ROSAnswers,PNI Digital Compass Driver,milar problems?I can't do anything about the battery life :) . I have however written some code i,[FP],,
ROSA133,DP208,https://answers.ros.org/question/44660/suggestions-on-using-irobot-create-with-hokuyo-urg-04lx-turtlebot/,ROSAnswers,Suggestions on using irobot create with hokuyo urg 04lx / turtlebot?,the 12V for Kinect. We use a Yanec external battery (6 Ah) with 5V and 12V (it has also a third,[hardware][FP],,
ROSA1329,DP209,https://answers.ros.org/question/265899/how-can-i-use-sensor_msgsbatterystate/,ROSAnswers,how can I use sensor_msgs/BatteryState,you can follow ) that will suscribe to your battery state topic.In the callback function you can,[battery info][voltage and capacity][howto][ROS topic],,
ROSA1324,DP210,https://answers.ros.org/question/241032/poor-results-of-loop-closurse-detection-rtabmap_ros/,ROSAnswers,Poor results of loop closurse detection rtabmap_ros.,can. I will make more algorithm tests but my battery is empty i need to wait for charge,[FP],,
ROSA1323,DP211,https://answers.ros.org/question/10235/android-and-ros-communication-over-usb-instead-of-wifi/,ROSAnswers,Android and ROS Communication over USB instead of Wifi,s would also ensure the android device stays charged. :P At least with the Android Honeycomb,[FP],,
ROSA132,DP212,https://answers.ros.org/question/53529/usb-graphics-card-for-ubuntu-1204lts/,ROSAnswers,USB Graphics Card for Ubuntu 12.04LTS,"You don't mention if it must be a laptop, or battery operated?The easiest path is to get yourself",[FP],,
ROSA1310,DP213,https://answers.ros.org/question/61517/turtlebot-teleop-running-no-response/,ROSAnswers,"Turtlebot teleop running, no response","Yes, everything is plugged in correctly and charged. Please help! Do you have TurtleBot 1 or T",[FP],,
ROSA131,DP214,https://answers.ros.org/question/27755/roomba-500-series-installation-problem/,ROSAnswers,Roomba 500 series installation problem,rate error and a complaint about the laptop battery being in Ma instead of Mw - is this some E,[battery info][wrong metric][battery diagnostic fails],,
ROSA1305,DP215,https://answers.ros.org/question/40830/irobot-create-and-beagleboard-failed-to-open-port-devttyusb0/,ROSAnswers,"iRobot Create and BeagleBoard ""Failed to open port /dev/ttyUSB0"" [closed]","should be getting clear, regularly repeating battery status messages - something like: ""bat: mi",[FP],,
ROSA1304,DP216,https://answers.ros.org/question/41815/raspberry-pi-optimization/,ROSAnswers,Raspberry Pi optimization [closed],a Raspberry Pi with the Turtlebot to save on power consumption and simplify charging.,[comment][curious to see][ros + raspberrypi saving energy],,
ROSA1302,DP217,https://answers.ros.org/question/12928/how-to-use-bilibot/,ROSAnswers,How to use bilibot?,does not come with USB-SCI cable and Create charger dock (for auto homing). Is that normal?Ma,[FP],,
ROSA1300,DP218,https://answers.ros.org/question/12294/starting-p3dx-using-p2os/,ROSAnswers,Starting p3dx using p2os,i others are not colored (red/green) and the battery is 0% even though the robot is fully charged,[battery info issue][displays dead battery][battery is full],,
ROSA1298,DP219,https://answers.ros.org/question/12048/status-stale-in-turtlebots-dashboard/,ROSAnswers,"Status ""Stale"" in Turtlebot's dashboard",ly available in ). Does it mean that (a) the battery of is left unused for long so that it has m,[battery info = stale][turtlebot dashboard][status not being updated],,
ROSA1293,DP220,https://answers.ros.org/question/136741/turtlebot-outputting-over-serial-but-not-receiving/,ROSAnswers,"Turtlebot outputting over serial, but not receiving",get data from the Turtlebot that seems to be battery charge information.How is it that I have a w,[FP][only says he only receives battery info],,
ROSA1284,DP221,https://answers.ros.org/question/10746/kinect-power-create-shutdown-issue/,ROSAnswers,Kinect power - Create shutdown issue,"can bring the robot down. (both lowering the battery voltage and draining the battery faster)
Thi",[irobot create][power down][minutes after connecting kinect][seems to be battery hardware or charge],,
ROSA1282,DP222,https://answers.ros.org/question/27623/turtlebot-roomba-create-power-issues/,ROSAnswers,turtlebot Roomba/ Create power issues.,. I am struggling with multiple dead roomba battery packs. If I can feed a fixed voltage throug,[roomba][checking power routine][howto][shuts off when lower than 13v],,
ROSA128,DP223,https://answers.ros.org/question/46782/information-about-turtlebot2/,ROSAnswers,Information about Turtlebot2,"he robot isn't docked (to avoid draining the battery), but I'll have to confirm that This post i",[avoid draining robot battery][connect to the netbook],,
ROSA124,DP224,https://answers.ros.org/question/212371/how-do-i-reset-the-odometry-topic-on-ardrone_autonomy/,ROSAnswers,How do i reset the odometry topic on ardrone_autonomy,date the firmware. Just make sure your phone battery and AR Drone battery is full and click updat,[FP],,
ROSA123,DP225,https://answers.ros.org/question/61244/can-a-smach-state-machine-be-paused-and-resumed/,ROSAnswers,Can a SMACH state machine be paused and resumed?,"machine. However, it is also monitoring its battery levels using a SMACH MonitorState. When the",[smach state machine][battery monitoring][auto docking][how to go back to the last state],,
ROSA122,DP226,https://answers.ros.org/question/228533/ekf_localization-odometryfiltered-topicfrequency-too-low/,ROSAnswers,ekf_localization: odometry/filtered topic:Frequency too low?,maximum cpu is utilized unless you're using battery power. It turns out that the default may be,[cpu tradeoff][battery consumption][odometry frequency],,
ROSA121,DP227,https://answers.ros.org/question/230198/which-single-board-computer-should-i-chose/,ROSAnswers,Which single board computer should I chose?,So I shouldn' t prefer it.Do you run from a battery? If so you might want to ditch the Cortex A7,[battery driven][avoid cortex a7][eMMC memory low power][7 A li-ion battery],,
ROSA120,DP228,https://answers.ros.org/question/236239/how-can-i-power-a-kinect-using-the-irobot-create-2-base-turtlebot/,ROSAnswers,How can I power a kinect using the iRobot Create 2 base? (Turtlebot),"ng the kinect?Or will I need an external 12V battery?Thanks! I'm relatively new to electronics, s",[physical stuff][FP],,
ROSA119,DP229,https://answers.ros.org/question/251805/i-need-help-writing-a-controller-node-for-a-drone/,ROSAnswers,I need help writing a controller node for a drone,will also ignore any mavlink commands if the battery is a dangerously low and return to their lan,[drone controller node][autopilots][ignore commands if battery low][battery low],,
ROSA117,DP230,https://answers.ros.org/question/296145/turtlebot3-low-battery-beeping/,ROSAnswers,turtlebot3 low battery beeping,"s source code so that it does beep when the battery is low. Thanks! Hi ,The buzzer you mentione",[turtlebot3][avoiding low battery beep][turtlebot3_diagnosis.cpp],,
ROSA115,DP231,https://answers.ros.org/question/331522/sending-velocity-commands-to-the-robot-throught-cmd_vel-topic/,ROSAnswers,sending velocity commands to the robot throught cmd_vel topic,I have another question!!! where to get the battery state so I can send an error message when th,[how to get battery info][comment][not answered],,
ROSA113,DP232,https://answers.ros.org/question/342128/ros-create2-ca_driver-dashboard/,ROSAnswers,ROS Create2 ca_driver dashboard?,ca_driver.It publishes several topics on the battery.when I run:rostopic echo /battery/chargeIt r,[battery info][Create2 robot][howto show it on dashboard][rqt_robot_dashboard],,
ROSA112,DP233,https://answers.ros.org/question/341812/turtlebot3-is-not-functionnig-on-his-bettery-i-dont-undrstend-the-problem/,ROSAnswers,turtlebot3 is not functionnig on his bettery i don't undrstend the problem,ts work but when i turn the turtle on by the battery the respbary3 does not turn on their is a re,[hardware stuff][FP],,
ROSA111,DP234,https://answers.ros.org/question/340524/open-mobile-manipulator-project/,ROSAnswers,Open Mobile Manipulator Project [closed],"0w dc-dc buvk converters(25),1 lipo 5000 mah battery(50), robot base could be just 2 leveled wood",[FP],,
ROSA110,DP235,https://answers.ros.org/question/314418/local-costmap-window-slowly-drifts-over-static-global-map/,ROSAnswers,local costmap window slowly drifts over static global map,s did not happen. It might be tied when the battery getting low.I will update with a bag file wh,[turtlebot burger][rviz][local costmap drifts][low battery][motor movement issue],,
ROSA11,DP236,https://answers.ros.org/question/208932/cannot-see-the-scan-data-of-rplidar-on-raspberry-pi/,ROSAnswers,Cannot see the scan data of rplidar on raspberry pi,"upply, worked fine!! It´s really a matter of energy!! Thanx a lot!! Saved my day!!max_usb_curren",[physical battery][FP],,
ROSA107,DP237,https://answers.ros.org/question/330995/battery-damaged-after-full-discharge/,ROSAnswers,Battery damaged after full discharge,One of my pupils let the battery plugged on the Turtlebot Burger 3 for one ye,[physucal battery][do not charge anymore][FP],,
ROSA106,DP238,https://answers.ros.org/question/321734/hokuyo-ust-10lx-power-options/,ROSAnswers,Hokuyo UST-10LX power options,uyo UST-10LX on my RC car and have separated battery to power the lidar and the car. To reduce th,[physical battery][FP],,
ROSA105,DP239,https://answers.ros.org/question/52203/kobuki-malformed-subpayload/,ROSAnswers,"Kobuki ""malformed subpayload""","e few times we did, we noticed that Kobuki's battery level was low. Could you test your netbook w",[kobuki robot][error message][robot unresponsive][not a battery issue][tested],,
ROSA104,DP240,https://answers.ros.org/question/318738/have-two-nodes-publish-to-same-topic/,ROSAnswers,Have two nodes publish to same topic,then have another node which sends only when battery is too low. I don't want to change anything,[battery info][publish even if battery is no low],,
ROSA103,DP241,https://answers.ros.org/question/313024/turtlebot3-burger-is-not-charging/,ROSAnswers,Turtlebot3 burger is not charging [closed],"requested in the online manual : unplug the battery, take it out of the robot, plug the white pa",[physical battery][FP],,
ROSA102,DP242,https://answers.ros.org/question/311408/rosserial-kinetic-error-5-inputoutput-error/,ROSAnswers,rosserial kinetic [Error 5] Input/output error,"would be the answer.Btw, I connected another battery to the motor to supply the working current/v",[ros serial connection error][when servo motor][arduino][low current],,
ROSA101,DP243,https://answers.ros.org/question/257182/getting-started-in-the-world-of-drone-programming/,ROSAnswers,Getting started in the world of drone programming,"need the drone to have around 30 minutes of battery(ideally more, but if not possible that will",[drone battery autonomy][shopping tip][FP],,
ROSA1,DP244,https://answers.ros.org/question/42315/ubuntu-1204-and-pandaboard-fails-to-open-asus-xtion-driver-issues-for-arm/,ROSAnswers,Ubuntu 12.04 and Pandaboard -> fails to open ASUS xtion/ Driver issues for ARM,lag of enough usb ports and the fact of less energy consumption). The compiling seems to work we,[energy efficiency][sbc asus xtion],,
ROSA0,DP245,https://answers.ros.org/question/193078/minimum-hardware-requirement-for-ros/,ROSAnswers,Minimum Hardware Requirement for ROS,. So we need to select the hardware which is energy efficient and can have ROS run on it. This,[hardware][energy efficient][ros compatible],,
REPO_P1069,DP246,https://github.com/sbrodeur/ros-icreate-bbb,Repositories,ros-icreate-bbb,{'visualize_hdf5': 'from clock Select only the subset related to battery voltage and current (respectively) Convert c'},[battery info][current and voltage],,
REPO_P1067,DP247,https://github.com/sbrodeur/ros-icreate-bbb,Repositories,ros-icreate-bbb,{'behaviours': ' # Activation of behaviour batteryLevel = float(state.battery.batteryCharge) / '},[battery info][behaviour switch],,
REPO_P1034,DP248,https://github.com/elpimous/Neo_robot,Repositories,Neo_robot,"{'qbo_energy_new': 'n speak just one time can speak when plug in power if unplugged, robot uses it internal battery'}",[battery info][speaks when charging],,
REPO_P1017,DP249,https://github.com/elpimous/Neo_robot,Repositories,Neo_robot,"{'qbo_energy': ""n attention shutdown soon... when you plug power on qbo side, you'll hear : charging !! charg""}",[battery info][speaks shutdown][battery too low],,
REPO_P1014,DP250,https://github.com/ipa320/cob_command_tools,Repositories,cob_command_tools,{'battery_monitor': 'ions and limitations under the License. % of battery level % of battery level % of battery level '},[battery monitor][thresholds],,
GitPR73,DP251,https://github.com/jsk-ros-pkg/jsk_robot/pull/1082,GitHubPRs,[jsk_pr2_startup] use new battery warning,"split from 
this battery warning is written by and used in PR1040.
c",[battery info][warning][battery voltage low],,
